"BMIG6Y57","journalArticle","2021","Mariano-Hernández, Deyslen; Hernández-Callejo, Luis; Solís, Martín; Zorita-Lamadrid, Angel; Duque-Perez, Oscar; Gonzalez-Morales, Luis; Santos-García, Felix","A Data-Driven Forecasting Strategy to Predict Continuous Hourly Energy Demand in Smart Buildings","Applied Sciences","","2076-3417","10.3390/app11177886","https://www.mdpi.com/2076-3417/11/17/7886","Smart buildings seek to have a balance between energy consumption and occupant comfort. To make this possible, smart buildings need to be able to foresee sudden changes in the building’s energy consumption. With the help of forecasting models, building energy management systems, which are a fundamental part of smart buildings, know when sudden changes in the energy consumption pattern could occur. Currently, different forecasting methods use models that allow building energy management systems to forecast energy consumption. Due to this, it is increasingly necessary to have appropriate forecasting models to be able to maintain a balance between energy consumption and occupant comfort. The objective of this paper is to present an energy consumption forecasting strategy that allows hourly day-ahead predictions. The presented forecasting strategy is tested using real data from two buildings located in Valladolid, Spain. Different machine learning and deep learning models were used to analyze which could perform better with the proposed strategy. After establishing the performance of the models, a model was assembled using the mean of the prediction values of the top ﬁve models to obtain a model with better performance.","2021-08-26","2025-10-30 09:04:31","2025-10-30 09:04:31","2025-10-29 17:18:57","7886","","17","11","","Applied Sciences","","","","","","","","en","","","","","DOI.org (Crossref)","","","<div data-schema-version=""9""><p>Presents a data-driven strategy for continuous hourly energy demand forecasting using ensemble and deep learning models (MLR, ANN, RF, XGBoost, LSTM). Real building data from Spain (2016–2019) are used for multi-step (24-hour) predictions with strong consideration of weather and occupancy data. An ensemble of top models achieved the best accuracy.</p> </div>","","","deep-learning; energy demand; Machine learning; multi-step forecasting; smart building; Time series forecasting; weather-data","","","","","","","","","","","","","","","","","","","","","","","","","","","","","","","","","","","","","","","","","","","","","","",""
"MZ3YR2G3","journalArticle","2023","Mascali, Lorenzo; Schiera, Daniele Salvatore; Eiraudo, Simone; Barbierato, Luca; Giannantonio, Roberta; Patti, Edoardo; Bottaccioli, Lorenzo; Lanzini, Andrea","A machine learning-based Anomaly Detection Framework for building electricity consumption data","Sustainable Energy, Grids and Networks","","23524677","10.1016/j.segan.2023.101194","https://linkinghub.elsevier.com/retrieve/pii/S2352467723002023","A suboptimal management or system malfunction can often lead to abnormal energy consumptions in buildings, which result in a significant waste of energy. For this reason, the adoption of advanced monitoring systems, based on Machine Learning (ML) and visualization techniques, is crucial to avoid possible deviations from the baseline energy consumption. However, the historical data on which analyses are based generally do not report the occurrence of anomalies. Therefore, the application of supervised ML techniques is limited and unsupervised approaches are favored. Moreover, domain experts find most Machine Learning (ML) techniques hard to interpret, and thus find it difficult to contextualize anomalies. To overcome these issues, this work proposes a machine learning-based Anomaly Detection Framework (ADF) that involves the use of two complementary semi-supervised ML applications to obtain a highly interpretable and accurate detection of anomalies. Both techniques use Symbolic Aggregate approXimation (SAX) encoding to extract the most relevant information from load profiles. The aim of the first approach is to maximize the interpretability of the definition and distinction between anomalous and normal behavior. This is achieved using a Classification And Regression Tree (CART), albeit at the expense of a coarser output granularity. The second approach exploits an Multi-Layer Perceptron (MLP) algorithm to obtain a higher and more accurate output resolution, although it leads to a less interpretable definition of any anomalous behavior. The ADF has been applied to a real case study using electricity consumption data provided by a large telecommunications service provider. The results show that combining both ML models enhances the accuracy and interpretability of the detected anomalies.","2023-12","2025-10-30 09:04:31","2025-10-30 09:04:31","2025-10-29 17:21:21","101194","","","36","","Sustainable Energy, Grids and Networks","","","","","","","","en","","","","","DOI.org (Crossref)","","","<div data-schema-version=""9""><p>Develops a semi-supervised Anomaly Detection Framework (ADF) combining SAX-CART and SAX-MLP models for high interpretability and accuracy in detecting anomalies in electricity consumption. Validated on real telecom facility data, showing improved detection of contextual anomalies and providing interpretable visualization for energy managers.</p> </div>","","","anomaly detection; cart; contextual-anomalies; energy monitoring; mlp; semi-supervised learning; Telecommunications","","","","","","","","","","","","","","","","","","","","","","","","","","","","","","","","","","","","","","","","","","","","","","",""
"7MUSIECV","journalArticle","2020","Mirhoseininejad, SeyedMorteza; Badawy, Ghada; Down, Douglas G.","A Data-driven, Multi-setpoint Model Predictive Thermal Control System for Data Centers","Journal of Network and Systems Management","","1573-7705","10.1007/s10922-020-09574-5","https://doi.org/10.1007/s10922-020-09574-5","This paper presents a system for jointly managing cooling units and workload assignment in modular data centers. The system aims to minimize power consumption while respecting temperature constraints, all in a thermally heterogeneous environment. Unlike traditional cooling controllers, which may over/under cool certain areas in the data center due to the use of a single setpoint, our framework does not have a single setpoint to satisfy. Instead, using a data-driven thermal model, the proposed system generates an optimal temperature map, the required temperature distribution matrix (RTDM), to be used by the controller, eliminating under/over cooling and improving power efficiency. The RTDM is the resulting temperature distribution when jointly considering workload assignment and cooling control. In addition, we propose the use of model predictive control (MPC) to regulate the operational variables of cooling units in a power-efficient fashion to comply with the RTDM. Within each iteration of the MPC loop, an optimization problem involving the thermal model is solved, and the underlying thermal model is updated. To prove the feasibility of the proposed power efficient system, it has been implemented on an actual modular data center in our facilities. Results from the implementation show the potential for considerable power savings compared to other control methods.","2020-10-19","2025-10-30 09:04:31","2025-10-30 09:04:31","2025-10-29 17:24:34","7","","1","29","","J Netw Syst Manage","","","","","","","","en","","","","","Springer Link","","","<div data-schema-version=""9""><p>Proposes a multi-setpoint Model Predictive Control (MPC) strategy for data center thermal regulation. The controller dynamically adjusts cooling setpoints using a data-driven model of thermal behavior. The framework improves temperature uniformity and energy efficiency under variable server loads and demonstrates strong fault tolerance and robustness through EnergyPlus simulation and real data validation.</p> </div>","","","","Cooling unit control; Data center power efficiency; Data center workload assignment; Efficient cooling; Model predictive control; Multi setpoint control; Thermal model; Thermal-aware scheduling","","","","","","","","","","","","","","","","","","","","","","","","","","","","","","","","","","","","","","","","","","","","","",""
"5ETG3BM2","journalArticle","2017","Ni, Jiacheng; Bai, Xuelian","A review of air conditioning energy performance in data centers","Renewable and Sustainable Energy Reviews","","13640321","10.1016/j.rser.2016.09.050","https://linkinghub.elsevier.com/retrieve/pii/S136403211630541X","During the last years, many countries are experiencing rapid expansions in the number and size of data centers to keep pace with their internet and cloud computing needs. High energy consumption of the data center has gradually attracted public attention. However, there are no common efﬁciency standards governing the design or operation of data centers and the associated air conditioning systems. And the statistical research on air conditioning energy performance is still sorely lacking. This paper presents a summary of 100 data centers air conditioning energy performance. Energy efﬁciency metrics and benchmarks are also provided so that operators can use these information to track the performance of and identify opportunities to reduce energy use of air conditioning systems in their data centers. The collected data from articles and reports show that the average of HVAC system effectiveness index is 1.44. More than half of the data centers’ air conditioning systems are inefﬁcient. In total, HVAC systems account for about 38% of facility energy consumption. The range for this usage was 21% for the most efﬁcient system and 61% for the least efﬁcient system. Moreover it would be necessary to review some currently available energy efﬁciency strategies such as economizer cycles, airﬂow optimization, energy management, and simulations tools.","2017-01","2025-10-30 09:04:31","2025-10-30 09:04:31","2025-10-29 20:13:29","625-640","","","67","","Renewable and Sustainable Energy Reviews","","","","","","","","en","","","","","DOI.org (Crossref)","","","","","","air cooling; Data center","","","","","","","","","","","","","","","","","","","","","","","","","","","","","","","","","","","","","","","","","","","","","","",""
"ZAMYQ4KG","journalArticle","2025","Olabisi, Patrick; Mayowa, Ahmed","Development of a Predictive Real-Time Temperature Management Framework for Data Centers Using a Hybrid Deep Learning Model","IIUM Engineering Journal","","2289-7860","10.31436/iiumej.v26i3.3629","https://journals.iium.edu.my/ejournal/index.php/iiumej/article/view/3629","","2025-09-09","2025-10-30 09:04:31","2025-10-30 09:04:31","2025-10-29 17:28:17","200-219","","3","26","","","","","","","","","","en","","","","","journals.iium.edu.my","","","<div data-schema-version=""9""><p>Develops a hybrid CNN–LSTM deep learning framework for predictive real-time temperature management in data centers. The system forecasts dynamic thermal fluctuations with 85–95% accuracy and 3–7% efficiency improvement. Suggests integration with feedback control loops and renewable sources to enhance sustainability and cost-efficiency.</p> </div>","","","hybrid models; real time control","CNN; Cooling Systems; Data Centers; LSTM; Temperature Management","","","","","","","","","","","","","","","","","","","","","","","","","","","","","","","","","","","","","","","","","","","","","",""
"IPPZKXSS","conferencePaper","2019","Ran, Yongyi; Hu, Han; Zhou, Xin; Wen, Yonggang","DeepEE: Joint Optimization of Job Scheduling and Cooling Control for Data Center Energy Efficiency Using Deep Reinforcement Learning","2019 IEEE 39th International Conference on Distributed Computing Systems (ICDCS)","","","10.1109/ICDCS.2019.00070","https://ieeexplore.ieee.org/document/8885255/","The past decade witnessed the tremendous growth of power consumption in data centers due to the rapid development of cloud computing, big data analytics, and machine learning, etc. The prior approaches that optimize the power consumption of the information technology (IT) system and/or the cooling system always fail to capture the system dynamics or suffer from the complexity of system states and action spaces. In this paper, we propose a Deep Reinforcement Learning (DRL) based optimization framework, named DeepEE, to improve the energy efficiency for data centers by considering the IT and cooling systems concurrently. In DeepEE, we first propose a PArameterized action space based Deep Q-Network (PADQN) algorithm to solve the hybrid action space problem and jointly optimize the job scheduling for the IT system and the airflow rate adjustment for the cooling system. Then, a two-time-scale control mechanism is applied in PADQN to coordinate the IT and cooling systems more accurately and efficiently. In addition, to train and evaluate the proposed PADQN in a safe and quick way, we build a simulation platform to model the dynamics of IT workload and cooling systems simultaneously. Through extensive real-trace based simulations, we demonstrate that: 1) our algorithm can save up to 15% and 10% energy consumption in comparison with the baseline siloed and joint optimization approaches respectively; 2) our algorithm achieves more stable performance gain in terms of power consumption by adopting the parameterized action space; and 3) our algorithm leads to a better tradeoff between energy saving and service quality.","2019-07","2025-10-30 09:04:31","2025-10-30 09:04:31","2025-10-29 17:23:10","645-655","","","","","","DeepEE","","","","","","","","","","","","IEEE Xplore","","ISSN: 2575-8411","<div data-schema-version=""9""><p>Proposes a DRL-based framework (DeepEE) for joint optimization of IT job scheduling and cooling control in data centers. Introduces a Parameterized Action Deep Q-Network (PADQN) to manage hybrid discrete–continuous actions and applies a two-time-scale control mechanism. Achieves up to 15% energy savings compared to conventional siloed methods.</p> </div>","","","","Aerospace electronics; Cooling; Cooling control; Data center; Data centers; Deep reinforcement learning; Energy efficiency; Job scheduling; Optimization; Servers; Task analysis; Temperature distribution","","","","","","","","","","","","","","","","","","","","","","","","","","","","","","","2019 IEEE 39th International Conference on Distributed Computing Systems (ICDCS)","","","","","","","","","","","","","","",""
"HD9JIXDW","journalArticle","2018","Ribeiro, Mauro; Grolinger, Katarina; ElYamany, Hany F.; Higashino, Wilson A.; Capretz, Miriam A.M.","Transfer learning with seasonal and trend adjustment for cross-building energy forecasting","Energy and Buildings","","03787788","10.1016/j.enbuild.2018.01.034","https://linkinghub.elsevier.com/retrieve/pii/S0378778817329171","Large scale smart meter deployments have resulted in popularization of sensor-based electricity forecasting which relies on historical sensor data to infer future energy consumption. Although those approaches have been very successful, they require signiﬁcant quantities of historical data, often over extended periods of time, to train machine learning models and achieve accurate predictions. New buildings and buildings with newly installed meters have small historical datasets that are insuﬃcient to create accurate predictions. Transfer learning methods have been proposed as a way to use cross-domain datasets to improve predictions. However, these methods do not consider the effects of seasonality within domains. Consequently, this paper proposes Hephaestus, a novel transfer learning method for cross-building energy forecasting based on time series multi-feature regression with seasonal and trend adjustment. This method enables energy prediction with merged data from similar buildings with different distributions and different seasonal proﬁles. Thus, it improves energy prediction accuracy for a new building with limited data by using datasets from other similar buildings. Hephaestus works in the pre- and post- processing phases and therefore can be used with any standard machine learning algorithm. The case study presented here demonstrates that the proposed approach can improve energy prediction for a school by 11.2% by using additional data from other schools.","2018-04","2025-10-30 09:04:31","2025-10-30 09:04:31","2025-10-29 20:11:30","352-363","","","165","","Energy and Buildings","","","","","","","","en","","","","","DOI.org (Crossref)","","","","","","forecasting models","","","","","","","","","","","","","","","","","","","","","","","","","","","","","","","","","","","","","","","","","","","","","","",""
"K7YMAUZC","journalArticle","2017","Wang, Zeyu; Srinivasan, Ravi S.","A review of artificial intelligence based building energy use prediction: Contrasting the capabilities of single and ensemble prediction models","Renewable and Sustainable Energy Reviews","","13640321","10.1016/j.rser.2016.10.079","https://linkinghub.elsevier.com/retrieve/pii/S1364032116307420","Building energy use prediction plays an important role in building energy management and conservation as it can help us to evaluate building energy eﬃciency, conduct building commissioning, and detect and diagnose building system faults. Building energy prediction can be broadly classiﬁed into engineering, Artiﬁcial Intelligence (AI) based, and hybrid approaches. While engineering and hybrid approaches use thermodynamic equations to estimate energy use, the AI-based approach uses historical data to predict future energy use under constraints. Owing to the ease of use and adaptability to seek optimal solutions in a rapid manner, the AI-based approach has gained popularity in recent years. For this reason and to discuss recent developments in the AIbased approaches for building energy use prediction, this paper conducts an in-depth review of single AI-based methods such as multiple linear regression, artiﬁcial neural networks, and support vector regression, and ensemble prediction method that, by combining multiple single AI-based prediction models improves the prediction accuracy manifold. This paper elaborates the principles, applications, advantages and limitations of these AI-based prediction methods and concludes with a discussion on the future directions of the research on AI-based methods for building energy use prediction.","2017-08","2025-10-30 09:04:31","2025-10-30 09:04:31","2025-10-29 19:52:52","796-808","","","75","","Renewable and Sustainable Energy Reviews","A review of artificial intelligence based building energy use prediction","","","","","","","en","","","","","DOI.org (Crossref)","","","","","","artificial neural network; hybrid models; predictive control","","","","","","","","","","","","","","","","","","","","","","","","","","","","","","","","","","","","","","","","","","","","","","",""
"DCLYHCD5","journalArticle","2021","Wei, Tianshu; Ren, Shaolei; Zhu, Qi","Deep Reinforcement Learning for Joint Datacenter and HVAC Load Control in Distributed Mixed-Use Buildings","IEEE Transactions on Sustainable Computing","","2377-3782","10.1109/TSUSC.2019.2910533","https://ieeexplore.ieee.org/abstract/document/8691496","The majority of today's power-hungry datacenters are physically co-located with office rooms in mixed-use buildings (MUBs). The heating, ventilation, and air conditioning (HVAC) system within each MUB is often shared or partially-shared between datacenter rooms and office zones, for removing the heat generated by computing equipment and maintaining desired room temperature for building tenants. To effectively reduce the total energy cost of MUBs, it is important to leverage the scheduling flexibility in both the HVAC system and the datacenter workload. In this work, we formulate both HVAC control and datacenter workload scheduling as a Markov decision process (MDP), and propose a deep reinforcement learning (DRL) based algorithm for minimizing the total energy cost while maintaining desired room temperature and meeting datacenter workload deadline constraints. Moreover, we also develop a heuristic DRL-based algorithm to enable interactive workload allocation among geographically distributed MUBs for further energy reduction. The experiment results demonstrate that our regular DRL-based algorithm can achieve up to 26.9 percent cost reduction for a single MUB, when compared with a baseline strategy. Our heuristic DRL-based algorithm can reduce the total energy cost by an additional 5.5 percent, when intelligently allocating interactive workload for multiple geographically distributed MUBs.","2021-07","2025-10-30 09:04:31","2025-10-30 09:04:31","2025-10-29 17:25:21","370-384","","3","6","","","","","","","","","","","","","","","IEEE Xplore","","","<div data-schema-version=""9""><p>Proposes a Deep Reinforcement Learning (DRL) framework for joint control of datacenter workloads and HVAC systems in geographically distributed mixed-use buildings. The method learns optimal energy-efficient strategies directly from data without physical models, achieving up to 26.9% cost reduction locally and 5.5% additional savings via distributed coordination.</p> </div>","","","Costs; markov","Buildings; datacenter; Deep reinforcement learning; Energy consumption; geographically distributed; Heuristic algorithms; HVAC; Load modeling; mixed-use buildings; Processor scheduling; Servers","","","","","","","","","","","","","","","","","","","","","","","","","","","","","","","","","","","","","","","","","","","","","",""
"UTFG3IE7","journalArticle","2025","Xie, Lingyun; Shan, Kui; Tang, Hong; Wang, Shengwei","AI-empowered online control optimization for enhanced efficiency and robustness of building central cooling systems","Advances in Applied Energy","","26667924","10.1016/j.adapen.2025.100220","https://linkinghub.elsevier.com/retrieve/pii/S2666792425000149","Adopting Artificial Intelligence for optimizing building system controls has gained significant attention due to the growing emphasis on building energy efficiency. However, substantial gaps remain between academic research and the practical implementation of AI-based algorithms. Key factors hindering implementation include computational efficiency requirements and concerns about reliability in online applications. This paper addresses these challenges by presenting AI-empowered online control optimization technologies designed for practical implementation. A simplified deep learning-enabled Genetic Algorithm is developed to accelerate optimization processes, ensuring optimization intervals are short enough for online applications. This algorithm also significantly reduces CPU and memory usage, enabling deployment on miniaturized control station for field implementation. To enhance stability and reliability, a robust assurance scheme is introduced, which switches to expert knowledge-based control under abnormal conditions. Hardware-in-the-loop tests validate the proposed strategy’s computation efficiency, control performance and operational robustness using a physical smart station controlling a simulated real-time dynamic cooling system. Test results show that the optimal control strategy achieves 7.66 % energy savings and exhibits strong operational robustness.","2025-06","2025-10-30 09:04:31","2025-10-30 09:04:31","2025-10-29 17:17:54","100220","","","18","","Advances in Applied Energy","","","","","","","","en","","","","","DOI.org (Crossref)","","","<div data-schema-version=""9""><p>Introduces a deep learning-enabled Genetic Algorithm for online optimal control of central cooling systems, balancing computational efficiency and robustness. Integrates an anomaly detection mechanism that switches to expert control under abnormal conditions. Hardware-in-the-loop validation confirms 7.7% energy savings and real-time adaptability.</p> <p></p> </div>","","","ai-driven-control; deep-learning; hvac; hybrid models; Optimization; practical; real time control","","","","","","","","","","","","","","","","","","","","","","","","","","","","","","","","","","","","","","","","","","","","","","",""
"GQPC646V","journalArticle","2022","Yang, Shiyu; Wan, Man Pun","Machine-learning-based model predictive control with instantaneous linearization–A case study on an air-conditioning and mechanical ventilation system","Applied Energy","","","","","","2022","2025-10-30 09:04:31","2025-10-30 09:04:31","","118041","","","306","","","","","","","","","","","","","","","Google Scholar","","Publisher: Elsevier","","","","case study; control strategy optimization; Machine learning; predictive control","","","","","","","","","","","","","","","","","","","","","","","","","","","","","","","","","","","","","","","","","","","","","","",""
